,Questions,"Responsible (0-Operator, 1-AI Agent)"
,"oyiga 2mln dan to'layapman, shuni oyiga 1 mln dan to'laydigan qilishning iloji bormi deb so'ramoqchiedimda, hamkasblarimdan so'rasam bankdan so'rab ko'ring aytadi deydi",0
,"Kreditga zayavka qoldirudim javobini qanday bilsam boladi,onlinegayam wunaqami",0
,"Assalomu aleykum, kartamga ulangan raqamni bankka bormasdan ham ozgartirsam boladimi,Bank shanba kuni ishlamas ekan, ham 17:00 ga yopilsa o’qish ishdan ulgirib boromimande, shuni onlayn qilsa bo’ladimi",0
,"Assalom aleykum Menga mikroqarz kerak, programmadan olomayapman",0
,"Man boshqa bankdan kriditim bor yana osam buladimi,Nomerini berin apertori",1
,"Кридет графики керак,Телефон ракамга уланмаганман,Кридет тулашим керак,График ташаб беринг",0
,Plastik kartam bloqlanib qogan,0
,"Men uzkartimni sms xizmatini yoqtirmoqchi edim,Pul tushsa yoki chiqsa sms keladigan qilish uchun?Menga yordam bera olasizmi?",0
,Кредит алажак едим,0
,"Master ishlamayabdi,Ishxona tomonidan berilgan,Bloklangan diyapdi,Yangi berilgan edi",0
,"Mening kartab bloklanib qoldi,Parolini ham untib qoydim,Kartamni blokdan chiqarishning qanday yoli mavjud",0
,Kredit uchun ariza tashlaganman shuni aniq javobini qanday bilsam bo’ladi,0
,"meni kartam. +998907007650 boglanip turgandi,Ending shu kartamdi +998907027650 rakamga koshishm kerak",0
,Assalomu alaykum. Mening nomimda bir nechta kreditlar boshqa banklarda mavjud. Agar kreditlar vaqtida tolanmasa yoki kechikib tolansa men sizlardan ochtirmoqchi bolgan jozibali 22% online omonatimdagi puldan kredit qarzimni yechib olishi mumkinmi? Meni omonatim daxlsizligi saqlanadimi sizlarda?,0
,"Plastik kartamga sms habarnomani yoqmoqchi edim,Hozir call centerga bog'langan edim,Siz bilan bog'lanishni aytdi,Sqb ilovasida shu bankdan ochilgan hamma kartalarim ko'rinib turar ekan. Endi bu ham ko'rinadimi yoki kartani qaytadan qo'shish kerakmi",0
,Манга ботда чикган ёзувви скрин клиб ботдан жунатин дидила Жамшид оператор,0
,"Смс хабарнома улангандан кегин канча вакт ичида скб мобайл иловасига улана оламан?,Канча вакт ичида кликга уласам булади?",0
,Doʻkonimning oldiga bankomat qanday ornatirsam boladi,0
,Onlayn mikroqarzga ariza bergandim mana shu javob keldi,0
,Мен куйилган омонатимни мудатидан олдин йечмокчи едим,0
,"Кредит олмоқчи эдим,Менга кредит бериладими йўқми шуни билмоқчи эдим,Иккиламчи кредит олмоқчи эдим ўзини ўзи банд қилиб 20.000.000 сўмлик",0
,"O’zini o’zin band qilganlar uchun 15 mlnlik kredit haqida eshitgan edim , shu kredit bormi ?",1
,"Men kredit olmoqchi edim, 3 shaxs qildim lekin lekin k6rinmayopti",1
,"Ariza 24 soatdn bere,Javob bermibdi,Sabab",0
,"Kredit tolagan edim otmayabdi operator raqami kerak qanday boglansam boladi,Xisob raqamidan qanday pul yechsa boladi",0
,Скб хумо картамни смс хабарномасини тел ракамини озгартириб беринг илтимос,0
,"Bankingizdan plastik karta olgandim shu karta bloklanib qolgandi,Shu muammo bo'yicha murojaat etyapman",0
,"Карта менга тегишли эканлиги тасдикловчи хужжатни электрон вариантини менга юбора оласизми, солик ходими сураяпти, илтимос,Мен андижонликман, пластик Тошкентдан берилган, Андижондаги банк филиал дан хам олса боладими?",0
,"sqb ilovadam kreditga ariza topshirgandim uni holatini qattan korsam boladi,hozir 19 yoshdaman va rasmiy ish joyim yo’q bo’lsa ham kredit beriladimi",0
,"Guliston filialiga visa karta kelganmi yoqmi malumot berolasmi,Call markazni nomerini bering",0
,"Humo картамни кодини эслай олмаяпман,Олган жойимга бормасдан пин кодни алмаштиришни иложи борми,Олган жойимга бормасдан пин кодни алмаштиришни иложи борми",0
,Garovsiz kridit turi yoʻqm,1
,мени visa пластик картамни хамда uzcard пластик карталаримни смс хабарномасини улатмоқчи эдим илтимос улаб берсангиз,0
,Doʻkonimning oldiga bankomat qanday ornatirsam boladi,0
,"Online mikroqarzga ariza beryotgandim ilovadan kafil soraldi nomer kiritdim lekin javob bermiyabdi dib chiqyabdi,sms bormadi,tel ham bolmadi kafilga",0
,Assalomu alaykum uzcar plastik kartamga sms xabarnoma yoqilmagan deb paymega ulanmayabdi,0
,"Ассалому алейкум, кредитим ёпилдими тўлиқ?,Рахмат, мошина тақиқдан қачон олинади??",0
,"Мен иловадан микрокридик карзга ариза топширганман,Хали хам жавоб бермади",0
,"Sms xizmatini ulashim kerak edi,Yordam bera olasizlarmi",1
,Plastik kartamga ulangan raqamni almashtirmoqchiman,0
,"Кодини алмаштириб бера оласизми,Картам humo,Очиб беришни иложи борми",0
,Online omonat haqida soramoqchiydim Sqb pridlojeniyada omonat koʻrinmay woldi,0
,"Kredid olmoqchi edim,Bankdan kredid olsa boladimi",1
,Мен иккинчи шахс кафиллиги билан микрокаризга ариза бергандим хали жавоб юк,0
,Картани бонкамадга солсам,0
,Омонатларимдан пул йечмокчиман лекин омонатим куринмаяпти менга пул зарур эди,0
,Omonatimni kursatmayobti,0
,"Омонатим хакида малумотга кирсам курсатмади,Кредит туладим кк ой охири",0
,"Onlayn omontlarim Sqb mobilega kurinmayapti,Qachon ishlab qoladi?",0
,"SQB иловасида вкладим куринмаябди,Качон ечич имконяти булади?",0
,"Men omonattim joyida ilovasidan kórinmayabti,Iltimos shunga aniqlik kiritib bersangiz",0
,"мен SQB га куйилган омонатимни йечиб олмокчи едим мудатидан олдин,Лекин оманатим куринмаяпти,Качон ишга тушади бу",0
,Anchadan beri kartamni ishlatmay faqat klik orqali foydalanardim keyin bankamadga borib naxt pul qilmoqchi edim kodini notogri terdim 1. 2 martta blmasdan notogri teribman blok bop qoldi,0
,Kartamni bilokdan ciqarolmayapman,0
,Sqb Mobile da omonotlar ko'rinmayabdi. Qachon ishlab ketadi?,0
,Kartani bilokdan chiqarolmayapman,0
,menga kartam boyicha kirim chiqim tranzaksilar haqida hujjat kerak edi soralgan joyga taqdim qilish uchun,0
,"Men sqb ilovasi orqali omonat qo'ygan edim. Va hozir u mening omonatlarim bo'limida ko'rinmayapti,Bu noqulayliklar bartaraf etilgunga qadar omonatlarimni qanday boshqaraman. Va tahminan qancha vaqtda bu muammolar bartaraf etiladi?",0
,"SQB Mobile ilovasida mani qoygan omonatim korinme qoldi,Qachon togirlanadi,Foizini doim yechib yana qoysa boladimi ustiga?",0
,Ака мани пластигим,0
,"Visa kartaga, Pul otqaza olmayabman,Server ulanib bolmadi deyabdi,Shu qachon togirlanadi",0
,assalomu aleykum meni master kart kartam ilovada koʻrinmayapti,0
,Visa karta Sanoat Qurilish ilovasidan chiqmay qoldi,0
,Онами виза карталари иловада кўрнмаяпти,0
,"Viza korinmay qoldi,Nima qilish kerak",0
,"Men ilovada visa kartam bor edi o'chib ketibdi qaytib qo'sha olmayapman,Qachon to'g'irlanadi? Joyiga qaytadimi?",0
,Visa karta korsatmayapti joyda prilojeniada,0
,мени пластигим кулифланиб колди кандай очсам булади,0
,Банк филиалларидан очередь онлайн олса боладими,0
,"Kridit olishda kridit oluvchini oylik maoshi qancha bolishi kerak,Nomida boshqa kriditi bolsa xam beriladimi,Onlayin topshirsa xam boladimi",0
,"Puliz chiqishiga xatolik berdi,Бу нима дегани?,Утказган пулимни чекини ололмаяпман",0
,хуллас мен бугин мастер карта олгандим банкилардан кин жойдадан регистрация отиш кере екан отдим регистрациядан мастер карта ози чикиши кере екан ози чикди картам лекин чиккан картани карта раками бошкача мани банкдан оган картани раками блан мос мас,0
,"Avozli xabar yuborsam boladimi,Men kredit olmoqchi edim,Shu boyicha molumot kerak",1
,Assalom. Karta bloklandi. Qanday blokdan chiqarsa bo'ladi? Sqb ilovasidan qilib bulmayapdi,0
,Iltimos esms xabarnomani yoqib bering,0
,Surogi tugagan kartamga pul qolib ketgan ekan shuni olishni iloji bormo,0
,"2 yilik kredit olaa,Shunda 1 yilga 30 % boladimi,Qanaqa yoki obshiy 2 yilga 30% mi",0
,"Sms xizmatini ulash kerak Eski raqamga ulangan edi lekin u raqam óchib ketibdi, endi yangi raqamga ulash kerak",0
,Assalomu alaykum Men mikroqarz uchun ariza jonatgan edim javobu nima uchun chiqmayabdi,0
,Assalomu Alaykum. Ikkilamchi kreditga ko'p qavatli kvartira(dom) olmoqchi edim. Sizlarda ikkilamchi kredit bormi,0
,Silzr jovop bersilarmi sqb kartaga,0
,"Assalomu alaykum Huma karta sms xabarnomani o‘zgartirib bering,U uchun qanday bosqichlardan o‘tay nima qilish kerak",0
,"Assalomu alaykum Huma karta sms xabarnomani o‘zgartirib bering,U uchun qanday bosqichlardan o‘tay nima qilish kerak,Havola bilan kirib to‘ldirdim so‘ralgan narsalarni",0
,"Ilovadan pul oʻtkazdim kvitansiyasi yuklanmayapti,Ilovani oʻchiraymi",0
,Men virtual mastercard ochudim lekin -5$ korsatib turibdi,1
,"Assalomu alaykum, bankda kredit karta bormi?",0
,Men qanday qilib kridt olsam boʻladimi,1
,"Kafilni yozdim tastiqladi qanaqa kiradi u bo'limga,Qatan kiraman u bo'limga,Qanaqa boshqaraman",0
,"Nega ilovadan kiredit olib boʻlmayapdi,Oldigi tartibdagi kredit maxaulotlari yoq,Ariza bersam javob ham kelmaydi,Sulurta polisi ham yoq garov uchun",0
,"kredit olishga murojaat qoldirgandim,javobi taxminan qancha vaqtda chiqadi,online arizani ko’rib chiqish muddati qancha",0
,"кредит картага заказ каердан киламиз,онлайн кредит олишни иложи йукми илова оркали",0
,"Urunova ziyoda kridet dan qarzdorligi bor,Ushani tekshirib bering",0
,"Ваалайкум ассалом онамни картасини жойидага кушсам боладими,Телефони кнопкалида мен куша олмайманми",0
,"Aperator nomerini bering,Sanoat qurilish bankining aperator nomerini",1
,"Assalamu aleykum biz SQB mobil ilovasi orqali hozirda sinob rejimida bogan ipoteka kreditini olmoqchi edik akam bilan,Akam qarz oluvchi men kafim bolayotgan edim akam meni kafilligimni yozib ozining mobil ilovasidan meni tasqidlashimni soradi lekin menga hech qanday kafillikni tasdiqlash uchun xabar kelmadi,Nima qilsak bo'ladi ?",0
,Men kartamga ulangan raqamni oʻzgartirmoqchi edim qanday oʻzgartirish mumkin,1
,Assalomu alekum yaxshimi siz meni SMS xabarnomamni ulavoring +998947650035,0
,"Assalomu aleykum, Sqb virtual kartasi haqida malumot kerak edi. Limitlar haqida, oylik va kunlik limitlar",0
,"Assalom aleykum. Online rezyume jo‘natmoqchiman,Bo‘sh ish o‘rinlari haqida malumot bera olasizmi",1
,"Kiridit olmoqchi edim,Birinchi marta olishim 2milon omoqchiman",0
,"Мен хали карта олмадим лекин счёт очсам буладими,Канча вактда очилади",0
,"Men kartamga ulangan raqamni oʻzgartirmoqchi edim,Qanday oʻzgartira olaman",0
,Телефони кнопкалида мен куша олмайманми,0
,Ваалайкум ассалом онамни картасини жойидага кушсам боладими,0
,Sms xabar ulamoqchiman,0
,Sms xabarnoma yoqtirmoqchi edim,0
,Assalomu aleykom Men Talaba Edim Farģon shaxridagi Koreya Xalqaro Universetida òqiyman SQB Bank Xodimlari kelib Plastikka ariza olib ketishgan edi 1 oy avval Shu plastigimiz tayyor bòldimikin yoki yoqmi,0
,"SMS xabarnomani ochirmoqchiman,Mankamatdanam ochirib bolmaydimi",0
,"Kredit ariza yo'llagan edim,Qachon ko'rib chiqiladi",0
,"mikroqarz berilmayaptimi,onlayn kredit olmoqchi edim",0
,"Bank kartasini qanday rasmiylashtirsa bo‘ladi,Assalom alekum Bank kartasini qanday rasmiylashtirsa bo‘ladi",0
,Hisob raqamida pul bor ekan. Shuni qanday kartaga ótqizib olsam bôladi,0
,"Uz plastik kartamni uchirtirmoqchi edim,Online bloklashni iloji yuqmi",0
,"Onlayn kridit olmoqchi edim olib bo‘lmayBdi,Qanday olsam bo‘ladi",0
,"Фоизларни хохлаган вактгача виртуал картада саклаб турса буладими,Куйган пулни фоизини",0
,"Men kartamdi biloklamoqchiman xichkm pul yecholmaydigan qilib,Shunaqa qilsa boladimi,Bankamatdan pul yechsa boladimi",0
,bank kartam 912602110 nomerga biriktirilgan shuni 330972110 ga otkazish kerak,0
,"Men kartamdi biloklamoqchiman xichkm pul yecholmaydigan qilib,Shunaqa qilsa boladimi",0
,иловага киришни имкони болмайапты блоктасиз деяпты,0
,"телефон номер бормы,муражат клишга",1
,"Plastic kartaga ulangan tel raqamimni o'zgartirishim kerak,Joyda ilovasidan foydalanishim uchun",0
,Kartam yoqolib qolgandi online karta olsam boladimi,1
,Salom man YaTT asosida tadbirkorlik uchun kredit olmoqchiman shu haqida batafsil tushuntirib bersangiz iltimos,1
,Meni plastigimga qaysi telefon nomer ulanganligini bilib bering bu yangi karta oʻzim Click ilovaga karta qo'shmoqchi edim boshqa raqamga ulangan deyapti,0
,"Assalom aleykum vaaleykum assalom,Ilovadan kredit omoqchi edim",0
,"Hisobimdagi karta raqamlarni vaqtincha block qilishni iltimos qilaman,Hisob raqamimni ham,Mening nomimga hech narsa rasmiylashtirilmasin iltimos",0
,Men kredit olishga ariza bergandim shuni korip shiqilmayapti,0
,Kafil va garovlarsiz offline kredit bormi,1
,"Manga yordam kerak,Plastik kartam yoqoldi,Shu unlangan nomerni oʻzgartirish kerak",0
,Xabarlar bo'limi qayerda ilovani,0
,Vertual kartani yuklomoqshi edim sms ulanmagan diyapti nima qisam boladi,0
,"Plastigimni yoqotdim,Oshani boshqa nomerga ulab,Pulni yechishim kerak",0
,"Menga kridit bermayapdi,Ariza natijasi kridit bo'yicha ilovani qayerda topsam boladi,100.000.000 millionga ariza yuborgandim",0
,Пластик блок булиб колиб ди,0
,"Assalomu aleykum meni mastercardim bor edi shu blok xolatida ekan hozir ochib yuborsa boʻladimi,Pul oʻtkaza olmayapman",0
,Valekum salom sqb kartamga ulangan nomerim kuydi yangi nomerga ololmadim,0
,"Va men bugun yangi sim kata olgandim shu orqali bank ilovasiga kiraman desam "" ushbu qulma orqali kira olmaysiz"" degan qizil yozuv chiqdi nima uchun",0
,"Man virual masterkar ochdim -5usd korsatvotti,Pullimi",0
,Man telfon raqmni ozgartirmoqchman bakdagi,0
,"Plastikni yoqatb qoydm qayta tiklamoqchiman SQB yakshanba kuni ishlaydimi qaysi filliali toshkent,Qayta ochtirish pullikmi",0
,"Kredit olmoqchi edik kafil sorayabdi. Men kafil bolmoqchi edim raqamimni kirityabdi hechqanaqa tasdiqlash korinmayabdi,Nima qilsak boladi",0
,"Men Sarmoya kreditini olmoqchiman lekin ololmayapmann,Meaning kartalarim degan joyidan kartam chiqmayapdi lekin kartam bor milliyning kartasi",0
,Ассалому алейкум манда битта муаммо картам нималаргадур уланган канака очирсам болади,0
,Этмокчи боганим виза картамни нималарга улаган болсам хаммасидан чиказвормокчиман,0
,"Mikro qarz olmoqchi boludim,lekin javob kemayapti,yoki kreditga pul berilmayaptimi",0
,Pulni qanday qilib kreditga yechtirsak boʻladi?,0
,Mikroqarz ololmayab man,0
,"Ага, т.е по первому номеру в скб мобайл я смогу найти и оплатить?",0
,"Кредитга заявление бергандим,3 соатдан бери куриб чикилмокда,Манимча жавоба тез келиши керак эди",0
,Бу кейин прямой картамга отарилиб бериладими йо бориб олишим керакми,0
,"Картам блок болиб колди,Пин код эсимдан чикди",0
,Qisqa Nomer bering,1
,Kartani telefon raqamiga ulash uchun SQB ning yaqin atrofimdagi filialiga murojaat qilsam boʻladimi yoki oʻzingiz qilib bera olasizmi,0
,Ассалому алейкум картамни телефонга улаш керак,0
,Кредит ариза бергандим жовоб кемаяпди,0
,Микро карз качон ишлайди,0
,"Филиалда номери борми,Мен танлаган,Номер. Булса берворинг илтимос",0
,Sanoat qurulish bank kredetlari haqida ma'lumot olmoqchiman,1
,"Onlayn mikro kredit olmoqchiman,Yordam bering",0
,"YANGI KARTA FAOLLASHTIROLMATAPMAN,QÕLIMGA OLGANIM YÔQ JOYIDA ILOVASIDA CHIQQAN",0
,"Ilovadan plastik karta buyurtma qilmoqchi edim bolmayapdi,Xarxlari haqida malumot beraszmi",0
,ХУМО картамни телефонимга смс уланмаган экан.кеча йозишган эдим сиз бн хам.,0
,Assalomu alaykum. Operator bilan ovozli muloqot qilsam bo'ladimi? Menda tushunarsiz holatbo'ldi,1
,Ассалому алекум яхшимисз онлайн микрокарзга ариза бергандим 3 кундан ошди хали жавоб келмади?,0
,Картам блокда,0
,Kartamning istoriyasi nimagadir shiqmayabdi,0
,"Assalomu alaykum kredit yuzasidan savolim bor edi,Qachon test rejimi tugaydi va mikro qarz olsa buladi kafillarsiz",0
,"Кирдит буйича,Лиминт ажрати лекин берсайоти",0
,"Assalom alekum.ariza topshirgandim ilovada kurinmepti,Jarayondami yuqmi shuni bilmoqchi edim",0
,"15 daqiqa degandi shunga bilaychi degandim,15 daqiqa degandi shunga bilaychi degandim",0
,Bonusni qanday olsma boladi,0
,Taklish qilish bonusni qanday olaman,0
,"Мани картам кулф болиб колоди очтирдим,Муддати утган кредит им бор",0
,"Mani kartam yoʻqolib qolgan,Osha ulagan nomerni orgartirib,Pulni otkazmoqchiman",0
,"Bank kartam bloklanib qoldi,Sms xabarnoma ulanmagan",0
,Blokdan chiqarish uchun nima qilishim kk,0
,Ассаломалекум клик улатмокчи эдим,0
,Картамни телефонга улаш керак,0
,Qancha kredit DAN shu oy uchun qancha qarzdorman shuni bilmoqchi edim,0
,"Plastigimda pulim qolip ketgan,Qanday qilib oliw kerak",0
,Online mikroqarz berilbotimi pagramanda,1
,Ассалаумаалейкум жойда иловага кушилмаймайапти,0
,"Assalom aleykum yaxshimisz. Overdraf kreditimni to'liq so'ndirdim shuni bazadan o'chiringlar,Nomimdan chiqib ketsin iltimos",0
,Meni nomimda nechta karta bor bilib bera olasizmi,0
,Joyda ilovasi orqali omonat quygandim online lekin u omonatni shartnomasini ololmayapman ilovadan. Hujjatlar Oferta bo’limida hech qanday hujjat ko’rinmayapti,0
,Shu omonatimni shartnomasini qanday olsam bo’ladi? Shunga yordam kerak,0
,Assalauma alekum men sqb viza karta oshtirgan edim lekin -64 000 qarz deb tur nimaga,0
,"Kiritid berilyapdimi,Xali ham",1
,Onlayn ravishda kafl orqali ham berilmayapdimi,1
,Kartaga ulangan nomerni uzgartirish kerak,1
,"Kredit rasmiylashtirmoqchi edim,Overdraft,Ma’lumot bering",1
,Assalomu aleykum Stependiya notoʻgʻri plastik kartaga tashlangan yangi ochilgan plastik kartaga qanday o'tkazish mumkin Chunki avvalgi karta yo'qolgan,0
,Kredit olmoqchiman,1
,"Assalomu alaykum, men SQB humo kartasini Nukusdan olganman, xozir Nukusda emasman, sms habarni boshqa raqamga qanday oʻtkazsam boʻladi, yani Nukusga bormasdan onlayn ulashni iloji bormi",0
,Кartamni telefonga ulatmoqchi edim,1
,"Men,Kreditim bor edi",0
,Garov evaziga kredit olmoqchi edim,1
,"Картам,Муддати тугапти",0
,Пластик картамнинг суроги тигади,0
,Бу ерда канака карта кушиш керак,0
,"Kartam pin kotga tushuvdi shuni chiqarish kerak,Kodini 3 marta xato tervordim",0
,Ассалому алайкум иловадан омонат куйиш учун хисоб очсам буладими?,1
,Assalom aleykum menga aloqa nomerlarizdi bering,1
,Assalomu alaykum. Sanoat qurilishi banki. Samarqand shahar Amir Temur bo'limida. Rubl almashtiradimi,0
,Nima buladi bloklasam tushuncha bering iltimos,0
,Kartmi nomerni almashtrmohchidm,0
,"Manda karta bloklanib qoldi,nma qilay",0
,"Sugʻurta asosida kredit olmoqchiman,Kredit tasdiqlangan. Avvaldan bank mijoziman",0
,Вертуал карта очиш керег,0
,Boshqa plastikni oʻz raqamimga ulab olsam boladimi,0
,Turmush oʻrtogʻimni plastikini oʻz raqamimga ulab olmoqchi edim,0
,Hozir oʻzlari botga yozishi kerakmi,0
,Bankamatan karta chiqmayapti,0
,Sbq pragramaga humo karta qowip otkarsa boladimi,0
,Joyida dan kridit olish imkoni bomayapti kechadan beri urinyapman ariza tastiqlanmayapti,0
,assalomu alaykum mani kartam bloklanib qolgan qanday qilib onlayn blokdan chiqazsam boʻladi,0
,Karta blok boʻlib qoldi pin kod xato kitilib,0
,"Man adashtirib pul jonatdim,Shuni qaytarib bering iltimos",0
,Kartam biloklandi ochib berolasmi,0
,Kafillikni qanday tasdiqlasam buladi,0
,Аssalom alekom men kartamni bilokdan chiqazmoqchiman,0
,Bankomat orqali nima qilishim kerak,0
,Менда омонат бойча саволим бор еди,1
,Омонат 1 ойда нечи марта толдирса болади,1
,Meni kartamni blokdan chiqarmoqchiman,0
,Manga sqbning Nurafshon filiali bank raqami kerak,0
,Men yangi karta olgandim quliplanib qoldi,0
,"Ariza yulladim,Kredit berasizlarmi",0
,Takliflar uchun bonuslarni qachon yechib olsa bóladi?,0
,"Men SMS xabarnoma yoqmoqchi edim,Men royxatladan otip",0
,"Тепадаги йозилганларди окий оласизми,Оператирлар жабов бермяпти",0
,"Козирги кунда карзим борми йокми уйга кагоз келди карз бор деп,Когоз йбормай тел килип шикса болмайдими",0
,"kartami tel nomer raqamini oʻzgartirmoqchman,sms habar telefon raqamini qando oʻzgartirsam boʻladi?",0
,"Kredit ariza topshirdim,Qancha vaqtda kutib chiqiladi",0
,Man siladan kredit omohchidim mikrozaym,0
,Srazu kartaga tashab beradimi?,0
,Kartam bloklanib qoldi,0
,"Mikrokredit olishga ariza jonatgandim,Negadir arizamga javob kelmasdan yoqolib qovotti",0
,"Assalomu alaykum, plastik kartamni ochib bering blocdan,Mobil ilovadan bloklagandim",0
,Kartam quplanib qolfi,0
,"Kredit karta olishga qayerda ariza qoldirsam boladi,Yoki kredit",0
,Kredit olishni imkoni yóqmi hozir shunda,0
,Sms xizmatni ulash kerak,0
,Мани картам смс хизмати ишламай колди шуни тузатиб беринг илтимос,0
,Мани кредит толагандим 51 мин сум фойзимни лекин хали кредит сум кайтирилмаган транзитте кирсам шикмаяпти,0
,Bayonot noma keregidi shu chek to'grisida,0
,Мани кредит толагандим 51 мин сум фойзимни лекин хали кредит сум кайтирилмаган транзитте кирсам шикмаяпти,0
,Assalomu aleykum 19yoshman institutda uqiyman 3mln gacha kredit beriladimi yomi garovsiz,0
,Ассалому алайкум яхшимисиз мен мурожат килгандим жавобини айтишмади шунга ёрдам беринг.,0
,12000000 limt chiqardi shuni qanday rasmiylashtirsam buladi,0
,SQB mobile dan kredit olsak boʻladimi,0
,Opa sqb uz kartasi bor rassiyadan pul tashlashsa tushadimi,0
,Sizlarda online kridit olsa boladimi,0
,Men mikro kredit olmoqshi edim sqb mobile programasidan,0
,qayeridan topsam boladi,0
,"Assalomu aleykum men ilovadan kredit olmoqchi edim,Kafilni nomerini kiritdim va javobi bolmayapti",0
,Assalomu alaykum sqb ilovasi orqali mikroqarz olmoqchi edim,0
,Shunga yordam bera olasizmi keyin nima qilishim kerak?,0
,Muqumiydagi filialila qatta,1
,Assalomu aleykum mobil ilovadan kredit uchun ariza yuborganidim osha arizani iltmos iloji bosa ochrib berila,0
,Endi qanaqa qilib kredit olsam boladi yordam bering SQB banktan olmoqchi edim,0
,"2 ta viza karta ochturuvdim bittasi viza va master klas kart,Ulolmayapman,Telefonimga",0
,"Шуни толаб мудатидан олдин копрог омокчидим шуни кориб бероласларми,Шуни сорамокчидим",0
,Кафил ёнимда кандай тасдиклашни билмаяпмиз айтворасизми,0
,"Assalomu alaykum, Visa Infinite kartamni prilojeniega bog’lay olmayaman,shu xatolik chiqvoti",0
,mikro kredit olish shartlari qanqa,1
,Onlayn kredit olmoqchi edim qanday amalga oshirsam boladi,1
,Qanday maʼlumotlar kerak boladi,1
,Har bir viloyatda bormi filiali,1
,Va alaykum assalom mikrokredit olmoqchi edim sqb mobile dan kafil qanday tasdiqlanishini bilmayapaman yordam bervorsez iltimos,1
,Assalawmaleykum. Men bankka borib naqd pulimni opamni plastik kartasiga oʻtkazmoqchi edim. Buning uchun opam bankga borishi shartmi?,0
,Ushbu amaliyot uchun qaysi navbatdan navbat olishim kerak,0
,Sms xabarnoma xizmati yoqilgan boshqa telefon raqamiga oʻtkazilishini surayapman,0
