,Questions,"Responsible (0-Operator, 1-AI Agent)"
,Bank kartasi yoqolgan tiklaw kerak,0
,"qancha bilan ochiladi bungayam pul beriladimi,Yoo bepulmi",0
,Men o'tgan yili bahorda PLASTIK karta ochtirgan edim lekin uni olmaganman. SHu kartani qayta ochtirsam bo'ladimi,0
,Karta kodini bankomatda notogri terilganligi sababli quliflanib qoldi,0
,Assalomu alaykum man joyida ilovasidan foydalanib yuraman kecha kelasi oy uchun va qarizimni tolov qildim tekshirib bersayiz,0
,Operator telefon nomeri bormi,1
,Keridit boyicha yozyutudm,1
,Kridit olishga yordam bering,1
,Plastik kartam yoʻqolib qoldi nomer ulanmagan edi,0
,SQB Humo Kartami Qayta tiklash kerak,1
,"kecha kridit olishga ariza qoldirgan edim,hali ham javobini bila olmayapman,15 daqiqada javobini aytamiz degan edi",0
,Plastik kartam bloklanib qoldi,1
,"Кредит онлайн олинадими,Еки факат тестовый режим хали елга коелмаганми",0
,Plastik kartam yoʻqolib qoldi nomer ulanmagan edi,0
,"kecha kridit olishga ariza qoldirgan edim,hali ham javobini bila olmayapman,15 daqiqada javobini aytamiz degan edi",1
,SQB bankga omonat qòyilganda omonat qòygan odamga biror xodisa bop qosa undan qolgan omonatni kim oladi,1
,Assalomu alekum mani kartam pin kodga tushub qopti hozir faol emas dib ishlatomayamman,0
,150 mln sóm 2 yilga kredit olmoqchiman. Necha foiz ustiga qóshiladi? Jismoniy shaxs uchun,0
,bu necha fozi bóladi 2 yil uchun?,0
,Шу буйича маьлумот олмокчиман,0
,"Man koreaga oqishga topshirmoqchiman,manga talim krediti beriladimi katta miqdorda",0
,"Онлайн кридит 24 саот ишламайдими,Аввал сразу олардик",0
,Бирон нима килдингизми ишлаб кетди,0
,"Assalomu aleykum, men kredit olmoqchi edim, boshqa bankdan olgan kreditlarimni yopish uchun",0
,"Bankga borsam sizga ajratilmaydi deyishdi.,Shu bankdan olamiz ish haqimizni, iloji bormi kredit olishning",0
,"Garov evaziga kredit olinsa Garovni qoyishda natariusga murojat qilinadimi,Yoki bankni ozoda hal qilsa bo’ladimi",0
,"Фарход, менга банкни транзит раками керак,Транзит ракамлари 23120000200011201502. Шу ракам бир хил буладими ? Ёки хамма филиалники хар хил буладими",0
,Manda MasterCard ishlamayapti puli bor lekin termilada pul yo'q ko'rsatvoti to'lov qilib bo'lmayapti,0
,Karta momosini hal qiberasilami,0
,Men kartam ulangan raqamni almashtrmoqchman,0
,"shu kartam ne aktiv turibdi,aktivlashtirishim kerak",0
,qanday ulasa bolad,0
,boshqa sim kartaga ulashni iloj bormi,0
,demak yangi pragramma ochib oshanga boshidan ulashim kerakmi,0
,KREDIT olish uchun is joyi hamda plastik kartada oborod bolish kerakmi,0
,"Kredit omoqchi edim,4oydan oshdi korxonada ishlamayman ish xaqim bor kredit osam buladimi",0
,"Menga kartamga ulangan nomerdi almashtirmoqchiman,Karta qôshish qilsam nomer soradi u nomer sotuvga chiqib ketgan",0
,Men internetta va televizorda kõrdim omonat ochib ham kuniga pul olsa bõlarkan shu rostm qanchalik tõgʻri,0
,"Kredit olish un online ariza berdim,Javobini qayerdan bilsam boladi",0
,Online kredit 10. 15 daqiqada chiqmaydimi,1
,"Farxod aka mani kartaman boshqa kartaga pul o'tib ketdi shuni qaytarishning iloni bormi ?,Aldashdi narsa xarid qilmoqchi edim",0
,"Assalomu aleykum yaxshimisz menga uzum marketdan pul kelib tushishi kerak edi,uzum market pulni tashlaganmiz deyapti kartaga ulangan bank bilan bogʻlaning deyapti",0
,Men internetta va televizorda kõrdim omonat ochib ham kuniga pul olsa bõlarkan shu rostm qanchalik tõgʻri,0
,Assalomu alaykum men kiridid olmoqchi edim lekin ariza bera olmayapman,0
,Салом мен нега микро қарз ололмаяпман,0
,Ха қолдиряпман лекин кафилнинг исмини киритолмаяпман,0
,Bank kartasi ulangan nomerimni oʻchirib mana shu nomerni ulashizni soʻrayman,1
,"Plastigim quluflanib qolipti,Ochip berolasizmi",0
,Mani kartamni bilok halotidan shiqarip berin,0
,Silar bilan ishm bitmayapti,0
,"Mani kartamdan pul yechishdi,Man amalga oshirmadim buni",0
,Гаровларсиз. Айланма карта оркали кредит олсам буладими. Мен сизларнинг банкингиздан анча йилдан бери фойдаланиб келаман,0
,Узимни узим банд килсам канча суммагача кредит олишим мумкун?,0
,"Uy joy uchun ikkilamchi kredit olgandik,265 mlnga kredit chiqqan oyiga 6.1 mlnnan dan kelyapti,agar asosiydan 70-80 mln qaytarsak oylik tolamlar kamayip yangi grafik berishadimi ?",0
,grafik ozgartirip berishadimi,0
,"Plastim kartani online ochish mumkinmi,Bloklangan mening kartam",0
,Kartam blok bo'lib qoldi,1
,"Pul o'tkazib bo'lmayapti,Blok bo'lgan bank tomonidan deyilyapdi",0
,"Men kredit olmoqchi edik,Wunga doimiy iw joyim yo'q olsam bo'ladimi",0
,"Yangi karta berishdi,K9rxonadan,Shuni sqb mobiledan registratsiya qilolmavomman",0
,"Кавилни номерини киргизсам,Хабарнома жунатилди деб. Лекин кемаяпти нмага каттан келада хаьар нома",0
,Mani profilimda yani povishena limit sabab?,0
,"Мен Россияа туриб силарди банкиларга пул утказдим,Лекин келмади,Аммо менда чеки турибди,Нима киле?",0
,"Пул утказмалари оркали, Яни приложение оркали,Тинкофф банкдан,Юбордим",0
,"крдит аризам канча вакти ичида корп чкилади,олдиндан рахмат",0
,"картамни мфо ракамини билмокчи эдим,кантрактимни кайтариш учун керак экан",0
,Ассалому алайкум мени пластик картам ни муддати 02 2025 экан охири ариза беришим керакми янгилаш учун,0
,Онлайн ариза бериш мумкинми?,0
,Sms kod kelmayapti,0
,Operatirni nomeri kere,1
,Uy joy subsidiyasi bo'yicha kredit olsa bo'ladimi,0
,Birlamchi bozordan uyni qayerdan topsam boʻladi,0
,"Men Sizlarni mobile dasturlaringiz orqali ayolimni To'lov shartnomasiga pul to'lamoqchiman, To'lamoqchi bo'lgan tashkilot sizlarni mijoz,kartalarimda pul bor, 1 soatdan o'tgan ulaganimga,Lekin xar safar pul to'lamoqchi bo'lganimda Kartad sms habarnoma yoqilmagan deb xatolik berib turibdi",0
,"Кредит олмокчи едим иловадан кафл га тасдиклаш бормайапди,Онлайн олса боладими",0
,Assalomu alaykum men soliq ilovasidan ortiqcha to'langan soliq summasini qaytarib olmoqchi edim shunga sqb bankdan olgan plastik kartamga o'tkazib olmoqchi edim shunga Surxondaryo viloyati filialining mfo raqami hamda uzkard plastik karta uchun tranzit raqami kerak bo'layapti shuni tashlab berolasizmi,0
,"meni kartamdan pul yechilyabdi ozidan ozi,shu raqamga ulangan kartadan",0
,"Кеча кридит расмилаштрудим хали тушгани юук,Шуни аниклаштириб берсангиз",0
,"ovozli xabar jo'natsa bo'ladimi,yaxshiroq tushuntirish uchun",0
,Men online mikrozaym olgan edim,0
,"SQB Insurans sug'urta pulini qaytarip olimoqchi edim. Lekin kreditingiz yopilmagan deb tur.,Online qanday yopaa bo'ladi",0
,менга телфон килин илтимос,1
,"Яхшмисиз кредитимни асосий карзим учун тулагандим графикда камайиш булмади нима килай,5 миллион сум асосий карзим учун жойида иловасидан кредитга тулагандим",0
,Sqb dan 3 yilga db kredit ogandm wuni 2 yilga qisa boladimi db soramoqciydm,0
,Qandoq krediti polniy yopish keremi wunda,0
,Bu narsani javobi qanchada chiqadi,0
,"Bizada eski bank klient edi, yangisiga qanday ulansa boladi",0
,"Mening kartam muddati tugabdi. Yangi kartaga bankka bormasdan zakaz bersam boʻladimi,Ilova orqali xarakat qilib koʻrdim lekin ishlamadi boshqa yoʻli bormi",0
,Kartam ulangan raqam ochib ketgan boshqa raqamga ulamoqchiman,0
,Менга нукус шахардаги банк оператори билан боғланишим керек,0
,"Хозир перевод килодик пулимиз тушмапти Рихсиев Зохидга,Шуни кориб берасизларми опа",0
,Shunda filalga barishim kerakmi,0
,"Men kiridit boʻyicha ariza bergandim javob kelmayabdi,Assalomu alaykum",0
,"Канча муддат талаб килинади тасдикланганми йукми,15 дакика дейилган 2соатдан утди ариза берилганига",0
,Ulanishning iloji bo'lmaayapti,0
,Kartam ulangan raqam ochib ketgan boshqa raqamga ulamoqchiman,0
,Менга нукус шахардаги банк оператори билан боғланишим керек,0
,Карта топиб олдим,1
,Assalamu alaykum joyda ilovam ulangan nomerimni almashtirsam boshqatdan identifikatsiydan o'tamanmi,0
,Mikroqarz ko'rib chiqish muddati qanaqa? Ilovadan so'rov yuborilgan,0
,qanaqa kamchilik ekanligi ko'rsatilmaydimi ? ya'ni aniq sababi?,0
,"Kafillik sorovini yuborishgandi,Chiqib ketib qoldim,Va topolmay qoldim,Ilovadan qande topsam boladi,Sorovni tasdiqlash uchun",0
,"Kreditim togrisida malumot kerak edi,Bankni Telefon raqamini bering",0
,Картамми тел номерини ўзгартирмохчидим,1
,Kredit ga kafil ga yuborgan edim qayeriga keladi Qanday tasdiqlayman,0
,qanday qilib pin kod qo'ysam bo'ladi bankka borishim kerakmi parol qo'yish uchun?,0
,CVV kod bo‘yicha Qayerda yozilgan bo‘lishi mumkin,1
,Men karta ochirmoqchi edm tekinmi yo pullik humo yoki uzkard kartlari,0
,ipoteka kriditini olsam yillik foizi qancha boʻladi,1
,Sqb mobile ilovasidan karta ochgandim men uni kup urinib bloklab quydim endi nima qilay,0
,ipoteka krediti ikkilamchi bozor uchun ham amal qiladimi,0
,kredit Faqat Sanoat Qurilish Bank mijozlari uchunmi?,0
,40 kungcha qaytarsh foizsiz Kiridit bormi,1
,Kartamga pul tushganda yoki yechib olinganda SQB mobile ilovasidan xabar kelmayabdi shuni toʻgʻirlashni imkoni bormi?,1
,Sqb ilovasidagi telefon raqamni oʼzgartirolmayapman,0
,Oldindan tolab qoymoqchiman shunga qaysi band boyicha qilay,0
,Пластикка уланган ракамни банкка бормасдан ўзгартирса бўладими,0
,Onlayn omonat quymoqchi edim 22% likka Bugun quyaversam ham buladimi Qabul qilinadimi,0
,Assalomu aleykum ertaga Sanoat qurilish bank ishlaydimi,0
,Men kreditga ariza topshirgandim Seshanba kuni qayta ariza topshirishim kerakmi?,0
,Ixtiyoriy soʻzga nima kirtsa boʻladi,0
,Asalomaleykum 17milyonlik kiridit limiti bormi,0
,Assalomu alaykum plastik kartani boshqa raqamga ulamoqchiman,1
,Ассалому алайкум .Картами смс хабарнома ёкиб беринг,0
,Карта блока шуни ошиш керак булиб колди,0
,Карта блокдан чкариш керак,0
,Ассалому алайкум менинг картам блокланди очишга ёрлам беринг,1
,Miqraqarz olmoqchi edim Online Shunga nechta kafil kerak,1
,Men kecha kredit olishga sorov jonatgandm Javobi qanchada chiqadi,0
,Assalomu Aleykum kreditmda prosrichka turbdi lekn man 7 milion oldindan yopganman,0
,Sizlarda to'lovlarni va o'tkazmalarni amalga ushirish uchun USSD kod mavjudmi?,0
,Indifikatsyadan òtkazishda ilovani orqa kamerasiga otkazsa bòladimi,0
,Ассалому алайкум кафил розилигини билдирди яна кафил сураяпти,0
,Иловага киришни иложи булмаяпти,0
,Man kridit omoqcidm kafilni tel nomerini yozdimde keyin kafilning jovobini kutmoqdamiz db ciqib qoldi,0
,Assalomu alaykum ayollarga talim kredeti haqida malumot beraszmi,0
,Махфий Суз деган жойга нима киритишим керак?????????,0
,Men katamga ulangan tel raqamni oʻzgatirmoqchi edim,0
,Pilastikni boshiqa nõmirimga ulomoqichiman,0
,Mening plastik kartamga ulangan telefon raqam o'chib ketkandi Shuni yangi raqamimga ulashni iloji bormi?,0
,Master cardni ga pin code qoyolmayapman,0
,Assalomu alaykum! Men onlayn mikroqarz olmoqchi edim. Lekin negadir ilova orqali olib bo‘lmayapti?,0
,Ассалому алекум идентификациядан утиб болмаяпти,0
,,0
,Sqb da kreditni karta bormi Bolsa programmani qayerida usha joy,0
,"Dadami kartalari xali, Blok bolib qoldi, Ochomayaman. Nma qilsam boladi",1
,Menga bugun 5 mln yana pul tuwiwi kerak edi lekin tuwmadi,0
,"Kredit olmoqchi edim, 30 milyon, Qanday olsam bo’ladi? Rasmiy ish joyim yo’q, Kafil bor lekin",1
,SQB mobil ilovasini yuklab olgan edim. Pasport maʼlumotlari qota deyapti,0
,Man oyma oy kreditimni yopib borayapman nimaga pochta orqali yana hat kelayapti yana boshqa adresniki,0
,Uzsanoatqurilish bankida Namangan davlat texnika univestiteti uchun toʻlanadigan kontrakt toʻlovlaridan usluga olinadimi yoki hizmat bepulmi?,0
,Assalomu aleykum bgun ish kuni lekn haliyam pul tushmadi qachon tushadi?,0
,Ассолому алайкум менга смс келяпди 01.04.25 карта муддат тугади деб кайси картам тугади,0
,"Здравствуйте, я не могу подключить карту банка НБУ на свой профиль.Они подключены к единому номеру",0
,Xujaynim 15%kredit olgan banklarizdan uzlari chetda Oʻzbekiston raqamiga clic ulangan kredit yechmayapti pul tashlagan kartalariga. Nima qilsi buladi,0
,"Здравствуйте. При оплате суммы за микрозайм в приложении выходит ошибка , «у вас есть ограничение для выполнения операции» Что можно сделать?",0
,"Шу масалада ёрдамилар керак, Жойида иловасида электрон хамёндаги пулимни картамга ўтказа олмаяпман, ""Ошибка при списании"" ёзувчи чиқябди",0
,Mening kartam bloklangan qanday qilib ochsam bo'ladi. PIN KODNI KO‘P TERISHGAN UYDAGILARIM,0
,Assalomu alaykum. Bank kartasiga ulangan raqamim kuyib qoldi. Oʻzim chet eldaman. Qanday qilib kartani sms kelishi uchun boshqa raqamga ulay olaman,0
,"men vizamdan boshqa vizaga otkazmoqci edim lkn Joyda ilovas bn oxshamayap nega, ilova orqali otkazma qilsa boladimi yoki yoq",0
,Ilovadan qanday kredit olsam boladi,0
,2024yilda fevralda kirditni ikkmartda kesdi. Kafildan ham kirdit olgan odamdan ham kesgan. Iltimos ammaliy yordam bershingizni so'rayman,0
,Assalomu идентификациядан ўтиб булмаяпти,0
,Meni plastik kartamdan pul yechilgan shuna aniqlash iloji bormi,0
,Mobil ilova orqi Mikroqarz olmoqchi edim. Uchinchi shaxs kafilligini belgiladim va xabar yuborildi degan yozuv chiqdi. Kafil uni qanday tasdqilaydi. Shu haqida ma'lumot bering.,0
,"картамми паролини эсимдан чкариб куйгандим, шуни банкка бормасдан туриб канакб узгартирсам булади? любой СКБ банкки филиалига борсам буладими или айнан картами катдан оган бусам ушатга боришим кереми",0
,Bugun meni kartamdan pul o'tkazib olishgan shuni qanday qaytarib olsam bo'ladi,0
,Хумо пластикимни шу ракамимга смс хабарини ёкиш керак,0
,Assalomu alaykum aka yaxshimisz. Men sqb mobile da omonatga pul qóyib borardim. Hozi Yana omonatga kirib qilmoqchi bólib summani yozib òtkazmoqchi bólsam servisda nosozlik desa ham Yana òtkazishga urundim va pulni yechib oldi lekin omonotga qòshmadi .plastikdagi pul òzizdan òzi yòq bóldi,0
,Omontga qoyilgan pulimdan yechib olishim kerak hozir juda zarur. 500 ming som. Omobatga pul qoyganman mobile ilova orqali. Ipi servir mi degan yozuv chiqyabdi,0
,Sqb mobile ilovasiga Master card kartamni ulay ololmayapman,0
,"Moy ID otolmayaman, Nma sabab",0
,Garov evaziga kredid omoqchiman. Kredid qanday osam buladi,0
,Assalomu alaykum plastik kartag sms xabar noma yoqish kerak,0
,Assalomu alaykum 30 mart kuni 06:16 da kartamdan pul ôtkazmasi bôlgan shuni kim tomonidan ôtkazma qilingan men ôtkazmaganman. Korib berin qanday qilib pul ôtkazmasi qilgan,0
,Assalomu aleykum sqb kartamni yoqtib qoygandim topib olgan odam ko'p marta noto'g'ri parol kirtib blok qilipdi . Shuni blokdan chiqarib Pulini bowqa kartaga tashalb olsan boladimi .,0
,Salom. Men Viza kartam boshqa nomerga ulangan. Shuni qanday oʻzgartirsam boʻladi,0
,Humo Kartaga ulangan nomerni o'zgartirmoqchi edim,0
,Assalomu alaykum. Sqb kartasini yoqotib qoygandik. Shunga o'wa kartani bowqatdan olib bilamzmi. Xarajatlari qanday bo'ladi,0
,"Sms habarnoma ochmoqchiman, Humo kartaga",0
,Adalomu alaykum Humo plastik kartaga sms yoqish kerak,0
,Assalomu alaykum Olmaliqda ochilgan plastikni toshkentdagi biror filialdan sms keladigan nomerini o‘zgartirsa bo‘ladimi?,0
,Assalomu aleykum. Humo kartasi bloklanib qolibdi. Oʻshani blokirovkadan chiqarishiz kerak,0
,Tranzit va MFO raqam kerak edi,0
,Identifikatsiyadan oʼtib boʼlmayapti. Rasmga olish ishlamayapti,0
,Assalomu alaykum. Aka men omonatga qoʻyganman pullarimni. Foyozni yechib oldim yana omonatga quymoqchiman. Lekin quyib bulmayabdi. Oshibka deyabdi,0
,Онлайн микрокарз ололмаябман. Сугурта билан,0
,Humo Kartamni boshqa nomerga ozgartish kerak,0
,Prilojeniyaga kartami qoshib bomayapti. Shuni tekshirib berin,0
,Joyida ilovasiga karta qoshib bomayapti karta boridi yo Bob qoldi,0
,Мен тажимуратова розагул SQB пластигимнен санитар тозалашга кол терминалынан 32мын сум 2марте алынды 113110470243 счетка алынды бирак туспеген,0
,SQB mobile ilovamgga kira olmayapman qatib qoldiю Ertalabdan buyon foydalanaolmayapman,0
,24 oylik omonat oshtirdim va undagi pulni sentyabr da qaytarib Ola olamanmi?,0
,"Телефон рақамини узгартмоқчи эдим, SQB HUMO vertual картада",0
,Salomalekum. Kredit olmoqci edm. Ariza rad etlyapti sababini blsam boladimi,0
,Kartamdan pul mablag'lari echvolimgan. lekn muddati o'tgan qarzdorlik chiqyapti.Ochirib berin katimdan,0
,Karta olgan edim sms kodi kelmayapdi. Yangi ochilgan Humo karta clikcga karta ulab bulmayapdi,0
,Assalamu aleykum yaxshimisz. Kreditga Ariza tashlagandim javobi kelmadi. Bilib berasizmi,0
,Mikro qarz foiz stavkasi tushdimi,1
,Sms xabarnomani yoqtirishim uchun botga murojaat qilishimni aytishdi. Telefon qila olasizmi?,0
,Kridit bolimidan kridit olomayaman 3 shaxs kafilligini kirgizsam ulaga hich qanday sms bormayapti,0
,Men treding bilan shugilanaman pul chiqarsam. Broker pul chiqazyapti bankdan kech tushyapti. Shuni tezlatishni iloji bormi.,0
,Менга кирит керак ёрдам. Пластикаларнигиз борми,0
,Viza pilastikim ilovadan uchib kitgan Qawqadaryo Qarshidan ochdirsam buladimi yoki pilastik ochilgan joydan borib ulatiwim kirakmi,0
,Здравствуйте. Я не могу получить микрозайм. Моя заявка уже 3 дня стоит,0
,Sms xabarnoma yoqish. 944121222 shu nomerdân 774177762 shu nomerga oʻzgartirish kerak,0
,Mening kredit bôyicha arizamni kôrib chiqishmayapti. 1 yarim soat oldin ariza bergandim,0
,Vaalekum assalom assalomu alekum yaxshimisiz oka sqb mobile ilovasi bor ekdiku shu ilovada 3 ta kartam ulangan edi bitta kartam uzidan uzi ilovadan chiqarib yuborilibdi qoshsam qoshib bolmaydi deyabdi. 2tasi sqb bankdan bittasi ipak yo'li bankdan edi 14,0
,Hamyondan qanday qilib pulni chiqarib olsa buladi,0
,"Кредит учун кафил тасдиклашга жунатмлди деб келди, Тасдиклаш кемаяпти.",0
,Pasportni uziga ham kridit olsa buladi,0
,"Meni SQB dan viza kartam bor edi. Lekin, muddati tugabdi. Aksiya payti bepul ochilgandi. Qayta tiklashni ilojisi bormi?",0
,"картамми паролини эсимдан чкариб куйгандим, шуни банкка бормасдан туриб канакб узгартирсам булади?",0
,Bugun meni kartamdan pul o'tkazib olishgan shuni qanday qaytarib olsam bo'ladi,0
,Хумо пластикимни шу ракамимга смс хабарини ёкиш керак,0
,Hozi Yana omonatga kirib qilmoqchi bólib summani yozib òtkazmoqchi bólsam servisda nosozlik desa ham Yana òtkazishga urundim va pulni yechib oldi lekin omonotga qòshmadi,0
,Sqb mobile ilovasiga kartamni ulay ololmayapman,0
,Kredid qanday osam buladi,0
,Assalomu alaykum plastik kartag sms xabar noma yoqish kerak,0
,Assalomu alaykum 30 mart kuni 06:16 da kartamdan pul ôtkazmasi bôlgan shuni kim tomonidan ôtkazma qilingan men ôtkazmaganman,0
,Men kartam boshqa nomerga ulangan Shuni qanday oʻzgartirsam boʻladi,0
,Kartaga ulangan nomerni o'zgartirmoqchi edim,0
,Assalomu alaykum. Sqb kartasini yoqotib qoygandik. Shunga o'wa kartani bowqatdan olib bilamzmi,0
,Sms habarnoma ochmoqchiman,0
,Adalomu alaykum plastik kartaga sms yoqish kerak,0
,Assalomu alaykum Olmaliqda ochilgan plastikni toshkentdagi biror filialdan sms keladigan nomerini o‘zgartirsa bo‘ladimi?,0
,Humo kartasi bloklanib qolibdi Oʻshani blokirovkadan chiqarishiz kerak,0
,Tranzit va MFO raqam kerak edi,0
,Plastik kartamga telefon raqamimini ulamoqchiman,0
,Kartamni boshqa nomerga ozgartish kerak,0
,Prilojeniyaga kartami qoshib bomayapti,0
,Qancha qarizim bor xozirgi davrgacha,0
,Joyida ilovasiga karta qoshib bomayapti karta boridi yo Bob qoldi,0
,SQB mobile ilovamgga kira olmayapman qatib qoldi,0
,24 oylik omonat oshtirdim va undagi pulni sentyabr da qaytarib Ola olamanmi?,0
,Телефон рақамини узгартмоқчи эдим,0
,Ariza rad etlyapti sababini blsam boladimi,0
,Kreditim bor edi qoshmcha kredit ololamanmi,0
,Kredit uchun onlayn ariza tashagandim atvet yuq Qanca vaqtda ichida koʻrib chiqilsi,0
,Karta olgan edim sms kodi kelmayapdi,0
,Yangi ochilgan clikcga karta ulab bulmayapdi,0
,SQB mobile ilovamgga kira olmayapman qatib qoldi,0
,Sms xabarnomani ulawim kerek,0
,Mening kredit bôyicha arizamni kôrib chiqishmayapti,0
,Kartamni sms xabarnomaga ulamoqchiman,0
,Hamyondan qanday qilib pulni chiqarib olsa buladi,0
,Кредит учун кафил тасдиклашга жунатмлди деб келди Тасдиклаш кемаяпти,0
,Garov evaziga 1 mln Qanday rasmiylashtirsam boladi,1
,Mikroqarz yoki kredit jarta olmoqchiman Nima qilishim kerak,1
,Kreditga ariza topshirgandim qanchada javobi chiqadi,1
,Bugun banklar ishga tushdimi,1
,Man kecha adashib boshqa kartaga pul utkazib quyibman Shuni qandey qaytarib olsam buladi,0
,Kecha boshqa raqamdan menga pul otqizilgan edi Unda kvitansiya bor lekin menga kelib tushmagan,0
,Мени пластигм блок холата еди шуни блок холаттан шигаршим керак болиб турибти,0
,Ariza bergandm Qanday bilsam boʻladi,0
,Ака менинг пластигим иловода куринмаяпти,0
,Assalamu aleykum men mikro qarz olmoqchi edim asosiy shartlari qanaqa,0
,Assalomu aleykum kreditga ariza yubordim javobi kemayabdi,0
,Bank kartamni tiranzit raqami kerak,0
,Viza kartamnin shu nomerga ulab berin,0
,Onlayin omanat ochkan edim shu omanatni ham shu nomerga boglashka kerak,0
,Omanatni toldirish yoki yeshib olish imkoni bolmayapti,0
,Kanvertatsiya qilomayaman,0
,Visa kartamga pul otqozomayam.,0
,Sms xabarnoma nomerimi qanday ozgartisam boladi?,0
,Sqb ilova mendan foiz olyapti,0
,Master card ga kredit olmoqchi edim Qanday olsa boladi,0
,Kreditga ariza tashlagandik ko'rib chiqish qiyin bo'lyapti nimaga,0
,Kirim chiqim pdf kerak edi sqb kartamdagi 30 va 31 martniki,0
,Assalom alikum tel raqamimga sms kilmayapti,0
,Kiridit kartani qanday olsam boʻladi,0
,Man kiridit olmoqchiman Qanqa xujjatla kere bo’ladi,0
,Online kredit mavjudmi Olmoqchi edim foyizlari qanaqa,1
,Kartam biloklanib qoldi iltimos ochib beringlar,1
,Ассалому алейкум Виза картамдан пул ечолмаяпман,0
,Ассаломк алейкуи скб банк онлине кридит беряптими хозир,0
,Plastik kartani boshqa raqamga ulamoqchiman,0
,СМС активировать килиш кере картамни Humo,0
,Samarqanddanman shu yerdagi filyalida qoldirsam bo'ladimi?,0
,Men sqb mobile orqali kreditimga toʻlov qilmoqchi edim lekin baza ishlamayaptimi tushunolmadim. Yordam bera olasizmi?,0
,Men SQB mijaziman menga kredit ajiratiladimi,0
,Картага пул уткахмалар пайтида телефон ракамга смс келмайдиган килса буладимии ?,0
,Omonatimni to'ldirmoqchi edim shunaqa yozuv chiqyapti nima bu,0
,Onloyn kridit olmoqchi edim Nomer kriting deyapdi Boshqa nomer yozib yuborsam otmayapdi Qanday nomer yozsam boladi,0
,O'zini o'zi band qilgan tadbirkorlar uchun kredit olmoqchi edim,1
,Ассалому алайкум март ойи учун канча карзим бор билиб беринг,0
,menga kirim chiqim malumotini bering kerak bo'lar ekanda ariza uchun,0
,"Кредит олмоқчи эдим, иккита кафил қўшдим. Лекин кейинги босқичга ўтолмпяпман",0
,Shuni pochtamga ulab qoyish imkoni buladimi,0
,Канакасига микро кредит олсам буладп,1
,Qartamga ulangan raqamni ozgartirmoqchiman Yangi raqamga ulamoqchiman,0
,Ishsizman shunda qanday kredit olsam böladi sizlari banklaridan,0
,Karta bloklanib qolodi wuni ociw keregidi,0
